{
  "schema": 1,
  "channel": "beta",
  "tag": "v0.0.1-beta.14",
  "repos": [
    {
      "id": "loader",
      "url": "https://github.com/petitechose-midi-studio/loader",
      "ref": "main",
      "sha": "fe4cb455128bdf6b7952d9bb78d066ffb20a623a",
      "required_ci_workflow_file": ".github/workflows/ci.yml"
    },
    {
      "id": "oc-bridge",
      "url": "https://github.com/open-control/bridge",
      "ref": "main",
      "sha": "fcdd61336a40c513bdb82b3bc474037f6677f97d",
      "required_ci_workflow_file": ".github/workflows/ci.yml"
    },
    {
      "id": "core",
      "url": "https://github.com/petitechose-midi-studio/core",
      "ref": "main",
      "sha": "bd906c25d8c1b4e2e57387ae5a8386193df1d8f3",
      "required_ci_workflow_file": ".github/workflows/ci.yml"
    },
    {
      "id": "plugin-bitwig",
      "url": "https://github.com/petitechose-midi-studio/plugin-bitwig",
      "ref": "main",
      "sha": "a4066cc923061b274516123d5651d30df0dc5838",
      "required_ci_workflow_file": ".github/workflows/ci.yml"
    }
  ],
  "assets": [
    {
      "id": "bundle-windows-x86_64",
      "kind": "bundle",
      "os": "windows",
      "arch": "x86_64",
      "filename": "midi-studio-windows-x86_64-bundle.zip"
    },
    {
      "id": "bundle-macos-x86_64",
      "kind": "bundle",
      "os": "macos",
      "arch": "x86_64",
      "filename": "midi-studio-macos-x86_64-bundle.zip"
    },
    {
      "id": "bundle-macos-arm64",
      "kind": "bundle",
      "os": "macos",
      "arch": "arm64",
      "filename": "midi-studio-macos-arm64-bundle.zip"
    },
    {
      "id": "bundle-linux-x86_64",
      "kind": "bundle",
      "os": "linux",
      "arch": "x86_64",
      "filename": "midi-studio-linux-x86_64-bundle.zip"
    },
    {
      "id": "firmware-default",
      "kind": "firmware",
      "filename": "midi-studio-default-firmware.hex"
    },
    {
      "id": "firmware-bitwig",
      "kind": "firmware",
      "filename": "midi-studio-bitwig-firmware.hex"
    },
    {
      "id": "bitwig-extension",
      "kind": "bitwig-extension",
      "filename": "midi_studio.bwextension"
    }
  ],
  "install_sets": [
    {
      "id": "default",
      "os": "windows",
      "arch": "x86_64",
      "assets": [
        "bundle-windows-x86_64",
        "firmware-default"
      ]
    },
    {
      "id": "default",
      "os": "macos",
      "arch": "x86_64",
      "assets": [
        "bundle-macos-x86_64",
        "firmware-default"
      ]
    },
    {
      "id": "default",
      "os": "macos",
      "arch": "arm64",
      "assets": [
        "bundle-macos-arm64",
        "firmware-default"
      ]
    },
    {
      "id": "default",
      "os": "linux",
      "arch": "x86_64",
      "assets": [
        "bundle-linux-x86_64",
        "firmware-default"
      ]
    },
    {
      "id": "bitwig",
      "os": "windows",
      "arch": "x86_64",
      "assets": [
        "bundle-windows-x86_64",
        "firmware-bitwig",
        "bitwig-extension"
      ]
    },
    {
      "id": "bitwig",
      "os": "macos",
      "arch": "x86_64",
      "assets": [
        "bundle-macos-x86_64",
        "firmware-bitwig",
        "bitwig-extension"
      ]
    },
    {
      "id": "bitwig",
      "os": "macos",
      "arch": "arm64",
      "assets": [
        "bundle-macos-arm64",
        "firmware-bitwig",
        "bitwig-extension"
      ]
    },
    {
      "id": "bitwig",
      "os": "linux",
      "arch": "x86_64",
      "assets": [
        "bundle-linux-x86_64",
        "firmware-bitwig",
        "bitwig-extension"
      ]
    }
  ],
  "pages": {
    "demo_url": "https://petitechose-midi-studio.github.io/distribution/demos/beta/"
  }
}
