{
  "schema": 1,
  "channel": "stable",
  "tag": "v0.1.0",
  "repos": [
    {
      "id": "loader",
      "url": "https://github.com/petitechose-midi-studio/loader",
      "ref": "main",
      "sha": "0000000000000000000000000000000000000000",
      "required_ci_workflow_file": ".github/workflows/ci.yml"
    }
  ],
  "assets": [
    {
      "id": "bundle-windows-x86_64",
      "kind": "bundle",
      "os": "windows",
      "arch": "x86_64",
      "filename": "midi-studio-windows-x86_64-bundle.zip"
    }
  ],
  "install_sets": [
    {
      "id": "default",
      "os": "windows",
      "arch": "x86_64",
      "assets": ["bundle-windows-x86_64"]
    }
  ],
  "pages": {
    "demo_url": "https://petitechose-midi-studio.github.io/distribution/demos/stable/"
  }
}
