{
  "schema": 1,
  "channel": "beta",
  "tag": "v0.0.1-beta.2",
  "repos": [
    {
      "id": "loader",
      "url": "https://github.com/petitechose-midi-studio/loader",
      "ref": "main",
      "sha": "bf751ab71a0dd4fabb22d61358c376ea579a611e",
      "required_ci_workflow_file": ".github/workflows/ci.yml"
    },
    {
      "id": "oc-bridge",
      "url": "https://github.com/open-control/bridge",
      "ref": "main",
      "sha": "5c10d357a4a6383ad645a6afc30f5f39ba4dee6f",
      "required_ci_workflow_file": ".github/workflows/ci.yml"
    }
  ],
  "assets": [
    {
      "id": "bundle-windows-x86_64",
      "kind": "bundle",
      "os": "windows",
      "arch": "x86_64",
      "filename": "midi-studio-windows-x86_64-bundle.zip"
    },
    {
      "id": "bundle-macos-x86_64",
      "kind": "bundle",
      "os": "macos",
      "arch": "x86_64",
      "filename": "midi-studio-macos-x86_64-bundle.zip"
    },
    {
      "id": "bundle-macos-arm64",
      "kind": "bundle",
      "os": "macos",
      "arch": "arm64",
      "filename": "midi-studio-macos-arm64-bundle.zip"
    },
    {
      "id": "bundle-linux-x86_64",
      "kind": "bundle",
      "os": "linux",
      "arch": "x86_64",
      "filename": "midi-studio-linux-x86_64-bundle.zip"
    }
  ],
  "install_sets": [
    {
      "id": "default",
      "os": "windows",
      "arch": "x86_64",
      "assets": [
        "bundle-windows-x86_64"
      ]
    },
    {
      "id": "default",
      "os": "macos",
      "arch": "x86_64",
      "assets": [
        "bundle-macos-x86_64"
      ]
    },
    {
      "id": "default",
      "os": "macos",
      "arch": "arm64",
      "assets": [
        "bundle-macos-arm64"
      ]
    },
    {
      "id": "default",
      "os": "linux",
      "arch": "x86_64",
      "assets": [
        "bundle-linux-x86_64"
      ]
    }
  ],
  "pages": {
    "demo_url": "https://petitechose-midi-studio.github.io/distribution/demos/beta/"
  }
}
